{"$schemaId":"https://schemas.cp6.dev/release/candidate-locator.v1","createdAtUtc":"2026-09-01T00:00:00.000Z","releaseTag":"v0.10.0-test.1","signerKeyId":"sha256:aaaaaaaaaaaaaaaaaaaaaaaaaaaaaaaaaaaaaaaaaaaaaaaaaaaaaaaaaaaaaaaa","subject":{"byteLength":1,"key":"objects/sha256/aa/aaaaaaaaaaaaaaaaaaaaaaaaaaaaaaaaaaaaaaaaaaaaaaaaaaaaaaaaaaaaaaaa/candidate-result.v2.json","mediaType":"application/vnd.cp6.candidate-result.v2+json","sha256":"aaaaaaaaaaaaaaaaaaaaaaaaaaaaaaaaaaaaaaaaaaaaaaaaaaaaaaaaaaaaaaaa","storageAuthority":"cp6-release-r2-v1"},"subjectKind":"SystemCandidateResult","trustPolicyVersion":1}